{
  "report_id": "USCCR-78456",
  "title": "Enforcement of Civil Rights Laws in Federal Employment",
  "report_type": "Advisory Committee Report",
  "publication_date": "2025-03-15",
  "topics": [
    "Race",
    "Employment"
  ],
  "states_covered": [
    "Race",
    "Employment"
  ],
  "advisory_committee": "California Advisory Committee",
  "url": "https://www.usccr.gov/reports/sample-report",
  "pdf_url": "https://www.usccr.gov/reports/sample-report",
  "summary": "This report examines federal agency enforcement of civil rights statutes and presents findings and recommendations.",
  "recommendations_count": 78
}